{
  "schemaVersion": 1,
  "status": "PHASE4_CANDIDATE",
  "runtimeEnabled": false,
  "achievements": [
    {
      "id": "FIRST_MERGE",
      "sourceId": "FIRST_MERGE",
      "name": "第一只牛马",
      "description": "完成第一次合成，正式入行。",
      "displayCategory": "合成",
      "hidden": false,
      "condition": { "type": "KPI", "kpiKey": "MERGE_COUNT", "target": 1 },
      "reward": { "salary": 50 },
      "integrationStatus": "PRESENTATION_ONLY"
    },
    {
      "id": "MERGE_10",
      "sourceId": "MERGE_10",
      "name": "十次合成，手没抖",
      "description": "完成 10 次合成，手感和工位一起稳定。",
      "displayCategory": "合成",
      "hidden": false,
      "condition": { "type": "KPI", "kpiKey": "MERGE_COUNT", "target": 10 },
      "reward": { "salary": 100 },
      "integrationStatus": "PRESENTATION_ONLY"
    },
    {
      "id": "MERGE_50",
      "sourceId": "MERGE_50",
      "name": "牛马批发户",
      "description": "完成 50 次合成，流水线见你先打卡。",
      "displayCategory": "合成",
      "hidden": false,
      "condition": { "type": "KPI", "kpiKey": "MERGE_COUNT", "target": 50 },
      "reward": { "salary": 200, "cultivation": 50 },
      "integrationStatus": "PRESENTATION_ONLY"
    },
    {
      "id": "MERGE_100",
      "sourceId": "MERGE_100",
      "name": "合成流水掌门",
      "description": "完成 100 次合成，手里的牛马排成了队。",
      "displayCategory": "合成",
      "hidden": false,
      "condition": { "type": "KPI", "kpiKey": "MERGE_COUNT", "target": 100 },
      "reward": { "salary": 500, "cultivation": 100 },
      "integrationStatus": "PRESENTATION_ONLY"
    },
    {
      "id": "SALARY_1000",
      "sourceId": "SALARY_1000",
      "name": "余额刚够点奶茶",
      "description": "工资余额达到 1000，下午茶终于敢加料。",
      "displayCategory": "财富",
      "hidden": false,
      "condition": { "type": "SALARY", "target": 1000 },
      "reward": { "cultivation": 30 },
      "integrationStatus": "PRESENTATION_ONLY"
    },
    {
      "id": "SALARY_5000",
      "sourceId": "SALARY_5000",
      "name": "工资卡有回音",
      "description": "工资余额达到 5000，钱包开始替你说话。",
      "displayCategory": "财富",
      "hidden": false,
      "condition": { "type": "SALARY", "target": 5000 },
      "reward": { "cultivation": 80 },
      "integrationStatus": "PRESENTATION_ONLY"
    },
    {
      "id": "SALARY_10000",
      "sourceId": "SALARY_10000",
      "name": "余额能撑到发薪日",
      "description": "工资余额达到 10000，点餐不必先看满减。",
      "displayCategory": "财富",
      "hidden": false,
      "condition": { "type": "SALARY", "target": 10000 },
      "reward": { "cultivation": 200 },
      "integrationStatus": "PRESENTATION_ONLY"
    },
    {
      "id": "SALARY_50000",
      "sourceId": "SALARY_50000",
      "name": "五万余额，满减自由",
      "description": "工资余额达到 50000，外卖凑单从此随缘。",
      "displayCategory": "财富",
      "hidden": false,
      "condition": { "type": "SALARY", "target": 50000 },
      "reward": { "cultivation": 500 },
      "integrationStatus": "PRESENTATION_ONLY"
    },
    {
      "id": "REACH_LIANQI",
      "sourceId": "REACH_LIANQI",
      "name": "初入职场，先别渡劫",
      "description": "初入职场，先把工牌和心态一起戴稳。",
      "displayCategory": "职业",
      "hidden": false,
      "condition": { "type": "CAREER_LEVEL", "target": 1 },
      "reward": {},
      "integrationStatus": "PRESENTATION_ONLY"
    },
    {
      "id": "REACH_ZHUJI",
      "sourceId": "REACH_ZHUJI",
      "name": "筑基成功，会议变多",
      "description": "达到第 2 档职级，需求文档开始主动找你。",
      "displayCategory": "职业",
      "hidden": false,
      "condition": { "type": "CAREER_LEVEL", "target": 2 },
      "reward": {},
      "integrationStatus": "PRESENTATION_ONLY"
    },
    {
      "id": "REACH_JINDAN",
      "sourceId": "REACH_JINDAN",
      "name": "金丹在身，开始带会",
      "description": "达到第 3 档职级，会议邀请终于不再漏你。",
      "displayCategory": "职业",
      "hidden": false,
      "condition": { "type": "CAREER_LEVEL", "target": 3 },
      "reward": {},
      "integrationStatus": "PRESENTATION_ONLY"
    },
    {
      "id": "REACH_YUANYING",
      "sourceId": "REACH_YUANYING",
      "name": "元婴出窍，看懂排期",
      "description": "达到第 4 档职级，排期里的弦外之音也听见了。",
      "displayCategory": "职业",
      "hidden": false,
      "condition": { "type": "CAREER_LEVEL", "target": 4 },
      "reward": {},
      "integrationStatus": "PRESENTATION_ONLY"
    },
    {
      "id": "REACH_HUASHEN",
      "sourceId": "REACH_HUASHEN",
      "name": "化神之后，需求自来",
      "description": "达到第 5 档职级，复杂协作先来问你的看法。",
      "displayCategory": "职业",
      "hidden": false,
      "condition": { "type": "CAREER_LEVEL", "target": 5 },
      "reward": {},
      "integrationStatus": "PRESENTATION_ONLY"
    },
    {
      "id": "REACH_LIANXU",
      "sourceId": "REACH_LIANXU",
      "name": "炼虚通勤，灵魂在线",
      "description": "达到第 6 档职级，早会迟到也能讲出重点。",
      "displayCategory": "职业",
      "hidden": false,
      "condition": { "type": "CAREER_LEVEL", "target": 6 },
      "reward": {},
      "integrationStatus": "PRESENTATION_ONLY"
    },
    {
      "id": "REACH_HETI",
      "sourceId": "REACH_HETI",
      "name": "合体归一，跨组不迷路",
      "description": "达到第 7 档职级，跨团队协作终于有地图。",
      "displayCategory": "职业",
      "hidden": false,
      "condition": { "type": "CAREER_LEVEL", "target": 7 },
      "reward": {},
      "integrationStatus": "PRESENTATION_ONLY"
    },
    {
      "id": "REACH_DACHENG",
      "sourceId": "REACH_DACHENG",
      "name": "大乘圆满，敢问截止日",
      "description": "达到第 8 档职级，面对排期敢先问验收口径。",
      "displayCategory": "职业",
      "hidden": false,
      "condition": { "type": "CAREER_LEVEL", "target": 8 },
      "reward": {},
      "integrationStatus": "PRESENTATION_ONLY"
    },
    {
      "id": "REACH_DUJIE",
      "sourceId": "REACH_DUJIE",
      "name": "渡劫成功，周报不慌",
      "description": "达到第 9 档职级，风险和周报都能提前安置。",
      "displayCategory": "职业",
      "hidden": false,
      "condition": { "type": "CAREER_LEVEL", "target": 9 },
      "reward": {},
      "integrationStatus": "PRESENTATION_ONLY"
    },
    {
      "id": "REACH_FEISHENG",
      "sourceId": "REACH_FEISHENG",
      "name": "副总监，工牌仍在",
      "description": "达到第 10 档职级，组织图再大也能找到自己。",
      "displayCategory": "职业",
      "hidden": false,
      "condition": { "type": "CAREER_LEVEL", "target": 10 },
      "reward": {},
      "integrationStatus": "PRESENTATION_ONLY"
    },
    {
      "id": "RARE_EVENT",
      "sourceId": "RARE_EVENT",
      "name": "稀有到像不加班",
      "description": "触发一次稀有事件，办公室突然讲起了概率。",
      "displayCategory": "事件",
      "hidden": true,
      "condition": { "type": "EVENT_TYPE", "eventType": "RARE" },
      "reward": {},
      "integrationStatus": "PRESENTATION_ONLY"
    },
    {
      "id": "EASTER_EGG",
      "sourceId": "EASTER_EGG",
      "name": "彩蛋捡到手软",
      "description": "触发一次彩蛋事件，确认今天的运气没摸鱼。",
      "displayCategory": "隐藏",
      "hidden": true,
      "condition": { "type": "EVENT_TYPE", "eventType": "EASTER_EGG" },
      "reward": {},
      "integrationStatus": "PRESENTATION_ONLY"
    },
    {
      "id": "PROMOTION_SUCCESS",
      "sourceId": "PROMOTION_SUCCESS",
      "name": "第一次升职，先截图",
      "description": "完成首次晋升，先把新工牌截图发给自己。",
      "displayCategory": "成长",
      "hidden": false,
      "condition": { "type": "PROMOTION", "target": 1 },
      "reward": { "salary": 200, "cultivation": 50 },
      "integrationStatus": "PRESENTATION_ONLY"
    },
    {
      "id": "PROMOTION_5",
      "sourceId": "PROMOTION_5",
      "name": "五连晋升，工牌升级",
      "description": "累计完成 5 次晋升，履历表厚到能挡会议邀请。",
      "displayCategory": "隐藏",
      "hidden": true,
      "condition": { "type": "PROMOTION", "target": 5 },
      "reward": { "salary": 1000, "cultivation": 300 },
      "integrationStatus": "PRESENTATION_ONLY"
    },
    {
      "id": "OFFICE_3",
      "sourceId": "OFFICE_3",
      "name": "工位升舱，插座够用",
      "description": "办公室达到 3 级，桌面终于能同时养活多台设备。",
      "displayCategory": "工作",
      "hidden": false,
      "condition": { "type": "OFFICE_LEVEL", "target": 3 },
      "reward": {},
      "integrationStatus": "PRESENTATION_ONLY"
    },
    {
      "id": "OFFICE_5",
      "sourceId": "OFFICE_5",
      "name": "高阶工位，摸鱼有门",
      "description": "办公室达到 5 级，连插线板都开始懂得留余量。",
      "displayCategory": "隐藏",
      "hidden": true,
      "condition": { "type": "OFFICE_LEVEL", "target": 5 },
      "reward": {},
      "integrationStatus": "PRESENTATION_ONLY"
    },
    {
      "id": "MIND_FULL",
      "sourceId": "MIND_FULL",
      "name": "道心满格，群消息免疫",
      "description": "道心达到满值，今天的群消息只算背景音。",
      "displayCategory": "隐藏",
      "hidden": true,
      "condition": { "type": "MIND_FULL" },
      "reward": {},
      "integrationStatus": "PRESENTATION_ONLY"
    },
    {
      "id": "IDLE_CLAIM",
      "sourceId": "IDLE_CLAIM",
      "name": "挂机有收益，老板没发现",
      "description": "首次领取离线收益，让挂机替你守住了一会儿工位。",
      "displayCategory": "摸鱼",
      "hidden": false,
      "condition": { "type": "IDLE_CLAIM", "target": 1 },
      "reward": {},
      "integrationStatus": "PRESENTATION_ONLY"
    },
    {
      "id": "SECT_JOIN",
      "sourceId": "SECT_JOIN",
      "name": "入宗门，先选阵营",
      "description": "加入宗门，给自己的职场修行选一个流派。",
      "displayCategory": "修仙",
      "hidden": false,
      "condition": { "type": "SECT_JOIN" },
      "reward": {},
      "integrationStatus": "PRESENTATION_ONLY"
    },
    {
      "id": "TALENT_PICK",
      "sourceId": "TALENT_PICK",
      "name": "天赋点亮，简历发光",
      "description": "选择一项天赋，找到适合自己的工作姿势。",
      "displayCategory": "修仙",
      "hidden": false,
      "condition": { "type": "TALENT_PICK" },
      "reward": {},
      "integrationStatus": "PRESENTATION_ONLY"
    },
    {
      "id": "WORK_1H",
      "sourceId": "WORK_1H",
      "name": "专注一小时，灵魂未散",
      "description": "累计工作 1 小时，把进度条和灵魂都往前推一点。",
      "displayCategory": "工作",
      "hidden": false,
      "condition": { "type": "WORK_SECONDS", "target": 3600 },
      "reward": {},
      "integrationStatus": "PRESENTATION_ONLY"
    },
    {
      "id": "WORK_10H",
      "sourceId": "WORK_10H",
      "name": "十小时渡劫，先喝水",
      "description": "累计工作 10 小时，记得给道心和水杯都留口气。",
      "displayCategory": "隐藏",